id,about,sector
168,"Based in Dublin, Ireland, we've specialised in providing comprehensive support, maintenance and networking for small to large companies since 1992. We offer a fast and efficient service that's focused on building the established reputation we already have. Formed in 1992 COMPUTER TECHNICAL SERVICES provide a large variety of services to its clients, from network maintenance services to full network implementation and support. The focal point of the company's business is providing high quality solutions to various corporate and non-corporate organisations computer problems. From network maintenance services to full network implementation and support, our aim is to provide high quality IT solutions to corporate and non-corporate organisations.",it
169,"Comsec Protection Systems is owned and managed by three brothers, John, Brendan and Ed Comey. They have an in-depth knowledge of the fire and security industry having worked in the business from a young age with their father Eddie Comey. While Eddie has since retired, the principals upon which he started the business in 1984 are still very relevant today; quality, accountability and reliability. By continually updating their skills, gaining relevant level 9 qualifications and keeping abreast of market developments, clients can be assured of top quality products and a service that few can match.",industry
170,"ConnectIT Software was founded in 1988 with the sole focus on supplying an integrated financial construction software solution to customers facing the challenges of dealing with plant, labour and procurement. Our solutions have been developed to efficiently manage your back office functions and integrate with your operations in an intelligent way, mirroring the construction industry-specific workflow and giving you complete control of your assets and projects.",it
171,"With over 40 years experience we are the first choice for specialist services such as concrete cutting, coring, crack stitching, waterproofing, jointing and concrete repairs to flooring, facades, etc. Working with the building and Civil Engineering industry across the U.K. and Ireland to bring solutions to both the business and private sector. Our reputation for professional workmanship together with our extensive knowledge of specialised materials, ensures that no matter what your project requirements, we have the ability to deliver on time and within budget on both short and long term contracts.",construction
172,"Construction Testing Services Ltd. provide independent, UKAS accredited,construction materials testing services for the Construction Industry,in Ireland and the UK.",construction
173,"ContinuPrint is a family run business that has been providing our Customers with exceptional Print Solutions since 1983. It is the experience gained in these years and the passion passed down that makes ContinuPrint Ireland's leading Print Supplier. Thanks to the exceptional flexibility of new technologies, partnering with ContinuPrint has never been easier. Whether you have existing artwork or no artwork, printed items you need replicated or a whole new design created - Our team of Graphic Designers are skilled at finding a cost-effective solution that meets your design requirements. Delivering our Promise All great things start with an idea. Speak with us about your idea and let's turn it into something great. Our mission is to 'deliver our promise' every time. Our friendly and professional advice, talented Design Team and our Specialised Print Staff are all passionate about giving you, the exceptional service you deserve.",print
174,"ith over 15 years in business Conway Carpets Omagh offers quality flooring products and exemplary customer service. When you need to buy flooring, either for an entirely new build or to replace worn out existing items, you can count on Conway Carpets Omagh to provide the products you need, all at competitive prices. Situated in the Gortrush Industrial Estate in Omagh,County Tyrone, Conway Carpets can provide you a personal experience in making your house a home.",industry
175,"Coolhill Heavy Haulage Ltd was formed in July 2000, by Alex Godfrey initially doing traction work for other haulier's, but moved swiftly into machinery haulage. A small family run business with Alex being the main point of contact and doing the bulk of organising of the vehicles and drivers. His wife Julie being the main contact administration wise, dealing with accounts, load details, permits etc. but is occasionally out on the road when the cabin fever gets too much!! Our approach to business is we have a passion for the variety and unpredictability of our workload. We obliviously like to work very closely with our customers and we take enormous pride in a job well done and a happy customer. Please Contact us for further information.",transportation
176,"YOUR ONE STOP COPY SHOP! Specialising in Photocopying, Large format printing, Plan copying, AutoCAD plotting, Rubber stamps, Shirt printing, Photo printing, Canvas printing, Roll-up banners, Posters, Flyers, Invitations, Business Cards, Letterheads, Compliment Slips, Laminating, Mounting, Document Binding, Mouse mat printing, Mug printing, Graphic design, Photo restoration, Document scanning ... and much more!",print
177,"Córas Pipeline Services are a trusted quality driven provider of engineering services, specialising in the delivery of infrastructure and building projects, across multi-utility and engineering sectors; for a range of government agencies, local authorities and blue chip industry clients. Based in County Meath, we have a young, mobile, trained and committed workforce, working across all regions of Ireland. Córas is a stable, private, engineer owned company who have built our reputation upon working collaboratively with our clients; understanding and assessing their needs and offering a safety first quality service with shared innovation and openness at its core. We are a Top Tier one stop shop provider of Design & Project Management (incorporating Safety, Health, Quality, Environmental, Estimating, Cost, Programme, Performance, Stakeholder and Customer aspects), Construction, Testing and Commissioning Services. Córas is a people first self-performing engineering contractor and service provider; we maintain a fleet of specialist plant, which gives us control and accountability in our operations. We have the experience, capability and a proven track record in delivering projects safely, on time and within budget.",construction
178,"We at Core Distribution are award-winning specialists in cable management, with 40 years of unparalleled experience providing our high-quality products at competitive prices. With close to €1.3 million in available stock between both bases in Belfast and Dublin, we ensure quick delivery and satisfaction to our electrical wholesaler and contractor customers across the whole of Ireland. Customer service does not stop at the end of a transaction; Our polite and knowledgeable staff ensure all our orders are packed and delivered properly with diligence and are always happy to answer any queries. We believe our customers are at the core of our company and give us power in progress.",electrical
179,"We offer a full range of support services including personal and business tax planning, bookkeeping services, VAT and payroll as well as prompt preparation of accounts. We can take care of routine financial and accounting operations, giving you peace of mind and the time to run and grow your business. We are also here to offer help and advice in terms of your personal tax affairs - please contact us today if you think we may be of assistance. At C.A.S., we pride ourselves on offering a friendly, prompt and efficient service. We offer comprehensive accounting and taxation advice for small and medium size enterprises, start-ups and individuals.",finance
180,"Craftpak is proudly based in Co. Dublin, Ireland. Our design, manufacturing & finishing facilities work from a 25,000-sq/ft. facility. Craftpak, an independent, Irish owned company, are specialists in bespoke packaging solutions that work, with our core business being the design, print and manufacture of cardboard boxes. Craftpak has earned a reputation as one of the leading packaging manufacturers in Ireland. Craftpak prides themselves on working closely with clients to achieve the best quality in bespoke packaging solutions. From their own in-house design studio Craftpak are able to conceptualise new packaging designs as well as supplied client drawings. They have the facilities & technical experience to design, print & manufacture of cardboard packaging. Craftpak is a total packaging resource from protective transit boxes to highly visual point of sale display units.",industry
181,"About Us We are an accounting and tax practice led by David Cranmer MIATI, FCA, AITI. David is a member of the Institute Of Accounting Technicians in Ireland, The Institute of Chartered Accountants in Ireland and The Irish Taxation Institute. David has extensive experience in professional practice specialising in owner managed businesses.",finance
182,"About Us Established in 1976, Creagh Concrete has grown to become one of the largest and most innovative producers of concrete products for a diverse range of market sectors throughout Ireland and the UK. The company operates from its Head Office in Toomebridge, Co Antrim with bases in Hoveringham and Edinburgh. Creagh Concrete has a number of specialist divisions working with each sector of the construction industry. The company's core product range is precast and prestressed flooring with an extensive range of flooring systems designed for commercial or residential applications.",construction
183,"Create Print is based in Derry-Londonderry, servicing the community with affordable print and design requirements. Call us today with your enquiry. We are a local Printing Company providing all your print requirements such as:- Flyers, Memorials, adverts, Company branding, Gift Vouchers, booklets, and many other types of print material",print
184,"Creative Signwork was founded by Marcus O'Neill in 2005. Marcus has over 20 years experience in all aspects of the sign industry. His growing desire to produce his own distinctive brand of sign design was the driving force behind his decision to open his own company. Creative Signwork is a unique sign and graphics business that can compete in all sectors of today's market place. The use of traditional craftwork along with high-tech CAD (Computer Aided Deisgn) and CAM (Computer Aided Manufacturing) Systems for use in its design and production enable the business to offer clients added value service. Our ethos is to provide each and every client with professional consultation, superior sign design and quality craftsmanship at realistic prices. Our mission is to create quality identities that are iconic and stand the test of time. We endeavour to help clients to increase sales and grow revenue with a more professional and consistant business identity. Giving your company the tools to successfully market and promote its services is what we do best. At Creative Signwork we can offer a vast range of products and services to suit many business requirements,",print
185,"Established in 1989 and building on over 30 years' experience Crescent Infrastructure has become one of Ireland's leading cabling and infrastructure specialists. Through Partnerships with industry-leading manufactures Crescent has delivered projects for some of the worlds most recognised brands. Crescent is positioned to meet the changing nature of the demand for ICT infrastructure products and services. With strong history and experience working with our customer and partners. Crescent has delivered Infrastructures projects across industries such as Data and Technology, Communications as well as Pharmaceutical, Health, Education, Retail, Public Sectors in Ireland and abroad. From structured cabling through to systems integration and professional services, Crescent Infrastructure prides itself on its ability to offer customers turnkey connectivity solutions.",it
186,"Crockard Building Design was established in 1993 by its principal, Ian Crockard, following a number of years working for Belfast based architect practices and qualifying from Queens University Belfast. As a practice, we believe we have a responsibility to protect and enhance the quality of our built environment and to create buildings that not only respond to the needs of our clients but also to the buildings' context within their urban or rural landscape with each being a unique site-specific response. Within practical boundaries, we aim to assess the sustainability and impact of the building materials, systems and construction processes used in the project and also how these might affect the immediate surroundings and wider environment.",construction
187,"CSM Print Solutions was established in July 2004 to service businesses in the North East of Ireland and beyond with a wide variety of print products. Since our inception our customer base has grown to include small businesses and multi-nationals. We understand and appreciate the importance to our customers of portraying themselves professionally to their customers and suppliers. We work in partnership with our customers, listening to their individual needs and striving to give 100% satisfaction. As a full-service print distributor we are dedicated to serving your business. In a world of rapid-fire demands and ever changing technology CSM Print Solutions commitment extends beyond just printing. Our focus is on making sure that your business objectives are constantly met, whether your decisions hinge on quality, price, lead times or a combination of all three. We are here to guide you every step of the way, in every aspect of print management. We value each customer and appreciate the limited time you have to make decisions and to manage the print process.",print
188,Philosophy at Commercial Spare PartsThe Commercial Spare Parts is to engage with its customers to build up a lasting business relationship which its customers trust at a competitive price. Commercial Spare Parts believes that customer service is paramount and listens to its customer's needs.Stocking the best brands availableCommercial Spare Parts identifies that its customers demand quality parts. They need to have confidence in what they are fitting. The components Commercial Spare Parts supplies satisfy the requirements totally with some of the worlds foremost leading brands.,transportation
189,"In today's fast moving consumer focused world, innovative and creative packaging design can give your business a leading edge over competitors. The importance of individually attractive yet highly functional packaging cannot be underestimated when trying to sell your product to today's discerning consumer - for information on the latest packaging products why not consult the experts at Cullen and Bohan Limited!",industry
190,"Custom bespoke design & manufacturers of staircases to trade & industry throughout Ireland. We also supply staircase kits, Spindles, etc to Trade.",construction
191,"Here at Custom Wood Designs we like to do things differently. We're not your usual woodworking company We specialise in branded wood. Our highly skilled team includes.. Designers, Master Carpenters & Wood finishers CNC Machinists & Laser Technicians. WE DESIGN, MANUFACTURE, BRAND, & FINISH To the highest standards possible EVERYTHING WE PRODUCE. Point of Sale Trade Stands Exhibition & Display Corporate Gifting Awards Timber Signage Branded & Promotional Products We provide a bespoke tailored service for our clients ranging from Small Business owners to Large Scale Corporations, Event, PR & Marketing Agencies We can create almost anything from wood that will get your Business or Brand noticed from one off pieces to a full production run. If you have an upcoming Event, Project or Promotion be sure to give us a call and see how CWD can Help You. OUR STORY How it all began... Dublin 2009 Gary, (23) a 3rd year building site apprentice Carpenter lost his job due to the Recession. With a passion for woodcraft he decided to do something different and thought himself to carve wooden signs, working from a Fairyhouse market stall and his grandmothers garden shed he mastered this trade and built a business.",print
192,"Cutting Edge Designs manufacture high-quality 3D & 2D routed components and various panel products in a large range of different materials. Coming from a mechanical engineering background we have over 17 years experience in CNC Routing and design, we understand the importance of precision, quick turnaround and a fair price. We pride ourselves on having an excellence working relationship with all our customersOur workshop contains 3 CNC Routers a fully automatic large format beam saw a melemine press and variuos other production and printing equipment, We have the capability to produce small simple cut out lettering and logos in 2D through to intricate 3d carvings.We can produce bespoke prototypes or thousands for multiple runs. All our data is archived so if you ever need a repeat order be it a week, month or even a year later, we can quickly and easily recall your file.( Please check our applications page for more details.)",print
193,"If you are looking for an experienced laser cutting service, then you have come to the right place! Established in 2008, Cutting Edge NI can give you high quality laser cutting for a very competitive price. We are laser cutting specialists in Dundonald, Northern Ireland. Using the latest and most efficient machinery, we offer laser cutting, folding and bending, welding, polishing, powder coating, painting and more. No job is too big or small.",engineering
194,"Welcome to the D Engineering Ltd web site. Established in 1970, D Engineering Ltd offer a comprehensive range of metalworking services: Profile Cutting (up to 100mm thickness) Lumsden Grinding (up to 600mm dia) Fabrication (up to 15 tonnes) Tube Profilling Shot Blasting Painting With knowledge and experience gained over many years, we offer a no nonsense approach to your requirements, while always remaining flexible and competitive to your needs. Working with one offs to production runs, D Engineering Ltd offers a SAME DAY service, as well as next day and breakdown cover. A service orientated business, we work from fully supplied or free issue material and our expert staff are always willing to help. D Engineering Ltd : Small enough to react - but big enough to cope. Home",engineering
195,"DA Miller & Sons Transport is a family run business who have been involved in the transport industry since 2004, specialising in recycling transport across UK and Ireland since 2009. Initially starting with just one vehicle transporting municipal waste to landfill, DA Miller & Sons Transport has gone from strength to strength over the past few years specialising in large volume bulk haulage using walking floor trailers ideal for the recycling industry. Our large volume walking floor trailers have a capacity of 110 m' (140 yrd3) with an ability to reach pay loads of up to 27 tonne; even with light weight material such as alloy wheels, farm plastic and dry mixed recyclables. With our main operating centre based in Ellesmere port we service customers on a daily basis across the UK.",transportation
196,"Daly Construction Ltd (DCL) has over 30 years of experience working in the construction industry in Northern Ireland, the Republic of Ireland and Great Britain. We were founded in 1984 by Michael Daly when he set up the head office in Carrickmore, Co. Tyrone, Northern Ireland. He expanded rapidly from Northern Ireland to Dublin and London, where most of our current operations are located. Michael's leadership continues to set the standard for the high quality work at affordable prices that ensures many clients give repeat business. Construction projects are always unique, complicated and against tight schedules. We provide excellence for all our clients by reliably delivering on quality, on budget, on time and give satisfaction again and again. At times construction can be very hazardous but our approach to working is such that health and safety is not compromised under any circumstances. Client satisfaction is paramount, Michael regards this repeat business as an important measure of how well our company is performing. We are a reliable, hard working construction company who will do everything to ensure our client gets the project services required. We make sure we can do this by selecting the right staff, energising them, training and rewarding them well and treating them with respect. Our people have pride in their work - this is crucial to Daly Construction's continuing high standard of performance.",construction
197,"Following continued growth since 2000 our former companies of PMF & RM Daly Ltd merged to form Daly Farrell Chartered Accountants, bringing together progressive and proactive practices. Our recent acquisition of Paddy Quinn & Co has further increased our talent pool, resulting in a value-enhanced business proposition that will maintain efforts in providing great services to our Clients and Prospects alike. Daly Farrell's expertise will bring a greater knowledge base to our clients as we strive to improve and evolve with the ever-changing world of business.",finance
198,"About Us Daly, O'Neill and Associates Ltd. are Chartered Architects based in Portadown. Formed in 1990 we have a wealth of experience in the profession. Since our establishment, our Practice has successfully undertaken a considerable variety of projects, ranging from £50,000 to £10 million, encompassing commercial work, public buildings and private housing. We offer a personal service with enthusiasm and a commitment to quality not quantity. Services Feasibility Studies Full Architectural Services Project Management Interior Design Planning Consultation CDM Coordinator If you would like to find out more about the services, which we offer then please do not hesitate to contact us and we will be happy to help you in any way that we can.",construction
199,"Home Civil engineering to make your project a success We offer engineering solutions to both commercial and domestic customers, ensuring that your project runs smoothly from design to completion. Call us today to benefit from our many years of experience in structural design and construction to deliver a project that you can be proud of. Reasons to choose us for your civil engineering solutions Many years' experience delivering successful projects Services available from design to construction and completions of your project Specialist Health and Safety advice for the safe and successful completion of your build Advices and solutions available for all of your questions and queries Available across Northern Ireland including the following areas: County Antrim County Armagh County Cavan County Derry County Donegal County Down County Fermanagh County Monaghan County Tyrone Plus many other areas!!",engineering
200,"At DLA we design beautiful, efficient and comfortable places for our clients to fully enjoy their adventure in life. Through our collaborative design process we design spaces that are designed around your needs and where you are involved in making the design work for you. The buildings we make take advantage of the site and the sun, they are low energy and we prefer to use materials that are kind to the planet. Have a look at our projects and feel free to contact us if you have any questions.",construction
201,"Datapart is a recognised Value-Added Reseller (VAR) of Hardware and provider of IT services. We specialise in the supply of spare parts as well as refurbished IT equipment, focusing on servers, networking and printer parts. Founded in 1994 by CEO Martin Clark, Datapart grew from being a supplier of printer parts to being a leading provider of an entire range of spare parts for OEM's, VAR's, Integrators, TPM's and Distributors. Our continued growth is testament to the loyalty and strength of the relationships we have forged with our customers, through comprehensive warranties, same day shipping and free technical support. We learned at an early juncture that success is gained through honesty, attention to detail, consistent quality, reliability and integrity.",it
