id,about,sector
527,"Legal Costs ADR Ireland's objective is to assist the parties, to a costs related dispute, in finding a timely and cost efficient solution to the diverse issues that often present in this specialised area of law. The available ADR processes are Mediation, Expert Determination and Arbitration. The parties must first choose the process that best suits their dispute and then a panel member that fits best with the issues that are required to be resolved. The panel members have been carefully selected from diverse backgrounds so that the parties' requirements will be met, regardless of the nature of the dispute. Presently, the panel is comprised of a retired Supreme Court judge, leading Barristers, Solicitors, Legal Costs Accountants and two former Taxing Masters who collectively, have real and contemporaneous knowledge to assist in resolving any legal costs dispute. The panel members are accredited Mediators, Arbitrators and/or Experts who each possess an intimate knowledge of costs related principles and allowances. Legal Costs ADR Ireland will assist the parties in their chosen process and will issue recommended Directions and steps to be followed (depending on the selected process). Once the parties agree upon the identity of the panel member to mediate or determine the dispute, Legal Costs ADR Ireland will co-ordinate the entire process from that point onwards. This will include arranging for the execution of the relevant Agreement, co-ordinating the exchange of Position Papers and suggested timeline of events, organising the venue and circulating the signed Agreement, Expert Determination or Award.",finance
528,"Phone Pulse was established in 1989 and has become a leader in IP Telephony Solutions nationwide. Headquartered in Bray, Co.Wicklow and with several regional support centres, we offer an exceptional localised on-site service to our customers. The significant growth of our client-base over 30 years is due to the range of cost effective and technology rich business communications solutions available from our innovative office phone systems product portfolio. Phone Pulse has accumulated significant experience in supporting clients over the last 30 years. This in-depth knowledge of our customer's environment enables Phone Pulse to offer informed, flexible and forward-thinking solutions. Phone Pulse is focused on being a high-calibre telephony service provider by differentiating itself from competitors through exceptional customer service. We achieve this by continuing to focus on building a highly skilled engineering team, which results in a more effective service model delivered by the largest field service team in the country. Phone Pulse has evolved to become one of NEC's Top 10 partners in Europe. This has strengthened our ability to deliver cost-effective telecoms solutions to our customers across all industry sectors. Our success has been achieved through the diverse range of business phone solutions that we provide to our loyal customers. This continues to challenge our team to be innovative in the design of efficient and effective solutions for the complex business world of today.",it
529,"We are Pinnacle. A Sage Platinum Reseller & IT Services Provider. A team of over 120 highly trained, experienced providers of Sage business management software solutions and IT services & support. Our multiple award-winning teams, including 5 times winners of the 'Sage 200cloud Partner of the Year' Award in 2014, 2015, 2016, 2017 & 2018 are located locally to our customers from 11 offices strategically positioned throughout the UK and Ireland. Since our inception in 1993, that's over 25 years in business, we have grown our business to 1000+ customer sites. Whatever the size of your business or industry sector you operate in, we've got a Sage software solution to suit your needs. From simple accounting and finance software to ERP solutions to manage your entire business, we'll help you find the right software for your business including Sage 200cloud, Sage Enterprise Management (Sage X3), Sage 1000 and Sage CRM. We can also advise your business on the best deployment methods - Cloud, Hybrid or On-Premise.",it
530,"Welcome to Pirtek Belfast, we are the number one fluid transfer solution and onsite repair provider in Northern Ireland. Pirtek's mission is to provide the fastest and most convenient service available, 24 hours a day, 365 days a year. Offering a comprehensive range of fluid transfer solutions, products & services to industries including: Agriculture; Automotive; Construction & Plant Hire; Defence; Environmental; Services; Manufacturing; Marine & Offshore; Material Handling; Mining & Quarrying; Transport & Logistics; Utilities. At Pirtek Belfast, we have four fully equipped mobile service units, operated by our fully qualified engineers, who are trained to the highest standards. In addition we have a fully stocked trade counter operating from 8:00 to 17:00 Monday to Friday and 08:00 to 12:00 Saturday, supplying all types of hydraulic hose, a wide range of hydraulic and engine oils, oil spill products, pneumatics and industrial hose. We also have 'machine shop' facilities to make custom solutions for all types of hydraulic adaptors, power steering pipes and hoses, and air conditioning hoses.",industry
531,"PKF-FPM (formerly FPM), is a client-focused chartered accountancy and business consultancy practice with offices in Newry, Belfast, Dungannon, Dundalk, Mallusk and Balbriggan, Dublin North. Our firm is member of PKF International, one of the top 12 global networks of accounting firms. We specialise in accounts and audit compliance, tax planning, cross border business and tax advice, business consultancy, strategic planning, corporate finance, corporate recovery, restructuring and insolvency, wealth management, and public sector consultancy including economic appraisals, evaluations and corporate governance assignments.",finance
532,"Potter Cowan is one of Ireland's leading trade only kitchen product and component distributors. With branches in Belfast, Dublin and Cork we distribute via our own fleet of vehicles - kitchen worktops, appliances, sinks, taps, solid surface and accessories to anywhere in Ireland.",construction
533,"The practice was established in 1978 by Roy Kennedy, Michael Campbell and Jim Kerr and traded as Kennedy Campbell & Kerr from premises in Broughshane Street, Ballymena until September 2015. The founding partners retired and there was a phased take-over of the practice between 2001 and 2004 by Steven Potter and John Finnegan. In November 2015, the practice changed name to Potter Finnegan Limited and relocated to a new office development in the grounds of Galgorm Castle. The practice now trades from purpose built open plan offices in a relaxed modern environment, with easy access and free car parking on the doorstep. The practice has been built on firm foundations and has a good reputation in the area and with other local professionals and businesses. We have a high rate of customer retention, with many of our clients literally being clients for life. We serve clients in the locality and further afield and cover a wide range of business sectors from agriculture and manufacturing through to construction and retail. We pride ourselves on our personal touch and attention to detail, always listening to our clients and responding as best we can to meet their needs. As a client, you always have direct contact to a director. We work closely with our clients to ensure that they receive appropriate and timely advice, allowing them to make informed decisions to grow their business. Appointments can be made at our office in Galgorm, or, where possible, our directors can visit you. We look forward to being of service to you. Potter Finnegan LtdChartered Accountants",finance
534,"PowerAir - Enhancing Industrial Productivity and Efficiency with Quality Air Compressors & Air Treatment Products PowerAir is Northern Ireland's leading supplier of premium air compressors and air treatment products. Since our inception in 1978, we've been providing customers with the highest quality of service and products in the industry. When industrial and commercial businesses require air compressors, ancillary equipment and air treatment products, they rely on our expertise. What sets us apart from other air compressor companies? We are the sole authorized distributors of the Ingersoll Rand air compressors dryers and filtration. We offer 24/7 emergency support services Our products are energy efficient and designed with the latest technological advances Our technicians are highly trained in the installation and servicing of all compressed air equipment We offer maintenance and support services for all of our products We carry an extensive selection of spare parts for all the equipment we sell Our warehouse is computer linked to Ingersoll-Rand and Parker-Domnick Hunter, so air treatment products can be ordered online immediately for next-day delivery.",industry
535,"Powerhouse IRL Ltd is an electrical engineering and systems integration company based in Co. Tyrone N.Ireland. We specialise in the design, manufacture, installation, commissioning and aftersales support of industrial control systems. We have extensive knowledge and expertise in executing projects for factory automation as well as both Static and Mobile machinery within the Construction, Agricultural and Quarrying sectors. We've have built our expertise and reputation over 15 years working with OEM's and end users designing control systems to fulfill their objectives and much more. We pride ourselves on being a valued partner as a Solutions provider of control panels and systems.",electrical
536,"Precision Print have been in business for over 15 years. Based in Dublin supplying nationwide. With our in house design service and on site printing we provide a fast, efficient and professional service with competitive prices to match. We print Litho and Digital giving you the choice of what best suits your requirements. Our design service covers all aspects of artwork for print including, designing logo's, flyers and other stationary and editingn existing artwork you may already have. Call us today for a competitive quote. One of our sales team would be delighted to call into your office to discuss your requirements if necessary.",print
537,"For over 25 years our dedicated team have been market leaders in the importation and distribution of quality Hardwood, Softwood, MDF & UPVC mouldings to the Irish Building Industry. Our business model was to supply mouldings to the Window installation industry, indeed it is still the core of our trade but now we also stock the finest quality Decking and Cladding products. There are many qualities that combine to make our company what it is today, perhaps none more so than our flexibility and willingness to try and make every business opportunity happen. However, it's our team spirit that truly sets us apart; a team that has the loyalty, passion, drive and ability to make a real difference.",construction
538,"Since its establishment in 1967 Pressco Engineering has remained faithful to its commitment to quality and close customer relationships. This has enabled us to stay at the cutting edge of our industry. We have grown from a jig and tool manufacturer to become a high-level manufacturing partner, supplying precision machined components and fully tested electro-mechanical assemblies to some of the biggest Medical Device, Aerospace and Hi-tech companies in the world.",engineering
539,"Primecourt Printers & Stationers Ltd was established in 1983, with the aim of providing a specialist print and stationery supply company to the Legal Profession. Over the past 38 years we have progressed and developed the company. Based on a wealth of experience, we have become one of the leading print/stationery supply companies in Ireland. Our customer base now includes Government, Corporate, Banking and Finance clients. Our policy of investment and constant market analysis has ensured that we are well placed in this sector. Our offices, stores and plant works are based in Dublin with a delivery service nationwide. We offer a complete in-house design, print and finishing service backed by a very reliable workforce and a secure financial footing. Whilst working closely with our customers, our priority is to supply high quality printed matter on time, every time. We strive to exceed customer expectations and are committed to achieving this aim with continued investment in technology, manpower and best practice.",print
540,"Print Bureau has been in the printing business for more than 25 years, and in that time we have learned a thing or two about print... that you expect top class quality, fast delivery and competitive prices. We print on modern printing presses, guaranteeing excellent quality. We operate two shifts a day, which ensures a fast turn around time. Our range of services extends from graphic to web design, from litho printing to digital print, wide format printing, variable data printing, mailing solutions, print finishing and nationwide delivery. As technology and customer requirements change, so do we... Graphic Design From logo design, stationery and corporate publications to posters, promotional material, etc. Lithographic & Digital Printing Business cards, stationery, flyers, brochures, folders, booklets, books... from one to thousands of copies. Wide Format Printing Posters, banners, popup and banner stands and other exhibition displays. Mailing & Fulfillment Variable data merges, printing, tabbing, addressing, packing and posting.",print
541,"One-stop turnkey service where you get to talk to a human being! We can design and print full colour double sided business cards that will help your business grow. Our experienced in-house design team can turn around your design requirements quickly, efficiently, and to a professionally high standard. We can fix you up a logo, a leaflet, a poster, even the layout for an entire magazine. Don't waste money on purchasing expensive office equipment when you can outsource your office needs to us. We have one of the best digital printers on the market, that achieves litho-like quality. We have a vast amount of experience in producing high quality items to honour a loved one's passing. We handle all enquiries with compassion and sensitivity, and offer a fair price. It's our aim to take away the stress of producing such materials, so you can concentrate on what really matters at a difficult time. Get in touch with us for a calm, sensitive consultation.",print
542,"Print Depot has been a trusted print supplier to a host of small, medium and large Irish businesses since the company was established in 1990. Over the intervening years, we have broadened our product offering from conventional printing to being a full-service communications partner to our clients, including point of sale materials and marketing collateral, both general and specialised. We can quite literally handle it all when it comes to conceiving, designing and producing high-impact print material and below-the-line marketing communications. As your communications partner, we are totally focused on delivering the results that you expect. Our involvement doesn't stop at production - we give you the benefit of our experience and expertise from the very outset, making sure that the end result fulfils and exceeds your expectations. With a team of friendly professionals on hand at all times, plus easy access to our senior management staff, we promise you that doing business with us is a pleasure every time.",print
543,"Formed in 2001 by experienced directors Geoff Truesdale and Michael Thompson, Print Library has always been at the forefront of print innovation. With the latest pre-press and press technology in our Heidelberg XL range, we promise unrivalled quality products for our customers. Our unparalleled technology allows us to service a range of customers. From entry level artisan producers with small print runs to renowned multinational clients across the food, drink, healthcare and lifestyle sectors, Print Library is tailored to meet the needs of each and every customer. Thanks to our BRC Accreditation, specialising in carton board litho printing, we ensure unique, high quality products, whilst always keeping our customers in mind. What's more, at Print Library, we pride ourselves on our ethical policies and processes with regards to recycling, human trafficking and anti-bribery.",print
544,"Printrun is one of Ireland's leading print companies. Since setting up in 1989 we have built a reputation for quality printing at a highly competitive cost, continually exceeding our clients expectations. Our high standards have been recognised in the industry, allowing us to achieve a number of prestigious awards. Our main objective is to work in partnership with our clients to ensure that we understand their business objectives and to offer cost effective print solutions. We understand the pressures of tight deadlines and budgets and will offer solutions through each step of the process.",print
545,"At Printcom we do much more than just PRINT! In addition to design and production of marketing and promotional print we also design and supply window graphics, vehicle graphics and other promotional print. We work with our clients to design and produce products that help them stand out from the crowd. We have expertise in inbound and outbound marketing products that ensure our clients attract attention in the market place.",print
546,"Printlink Print & Design Studio is a full service Print & Design company with over 25 years experience in the Printing Business. We provide in-house services from design, small / wide format printing right through to lamination, finishing & installation.We work closely with all our customers to elevate their brands & promotions. Contact us Today on (01) 871 2493 Or email : info@printlinkireland.ie",print
547,"PrintPac was founded on 1984. The company has an excellent reputation for producing high quality printing at a competitive price, on time as promised. We offer a personal and confidential service. Our staff are always willing to help and advise with practical suggestions and technical solutions. Whatever your requirements we can help with friendly professional advice. We have consistently invested in new technology and recently installed a Presstek 52 di press (waterless and chemistry free environmentally friendly printing). We are committed to improving our impact on the environment and helping our clients along the way (see our Eco Printing page).",print
548,PRO SIGNS Specialises in: - Vehicle Graphics Solutions - Reflective Chevron Markings Solutions - Chapter 8 Reflective Chevron Kits - Internal & External Signage - Wall Graphics - Fascia Signs Specialist & Approved Installer for 3M Emergency Service Kits.,print
549,"Since 1999, we've made a name for ourselves by specialising in the business of t-shirt printing in Dublin and all over Ireland. However, our expertise goes beyond it. We do a lot more than just screen printed t shirts; we also offer embroidered clothing for promotional use or as corporate workwear, personalised gifts, branded promotional products, banners and a wide range of promotional print materials. Process Print's embroidered and printed clothing, personalised gifts and promotional merchandise are created in such a way that enhances your company's image, whatever your market may be. Through our years in the printing industry, we've come to understand that branded promotional items, personalised gifts and custom work-wear are a powerful method of advertising your company in corporate and social surroundings. With our extensive experience and expertise in the arena of promotional printing in Dublin, Process Print can produce a print of your logo or design on any type of promotional item, customized gift and personalized clothing. Our services are done in-house, ensuring that our customers receive a unique edge in quality control while enjoying quick turnaround times to meet events and promotional events that you may be running, in short you can get the top and satisfactory promotional printing in Dublin right here. At Process Print, we make use of a unique 5-step procedure that helps guarantee the quality of our customers' promotional items, personalized gifts and custom work-wear. These steps ensure that our printing standards don't just meet, but exceed our customers' expectations. Whether it's printed shirts for events, personalized items such as pens, letterheads, mugs, or embroidered clothing for corporate use, we at Process Print promise to deliver unparalleled quality and customer satisfaction Our entire range of services can be viewed through our online catalogues. Feel free to make any inquiries about our products and services through our contact page, and we'll do our best to get back to you within the next 24 hours. We are the experts at T-Shirt printing in Dublin and Ireland and you can surely trust our expertise.",print
550,"At Procon Skyhire, we offer a comprehensive fleet of powered access platforms for working at height including electric scissors, diesel scissors, electric cherry pickers, diesel cherrypickers, telehandlers, and telescopic forklift services. With offices based both in NI and ROI, Procon Skyhire are ideally located to respond quickly and provide high quality height solutions across Ireland. Our aim is to provide a reliable professional service with all the qualifications of a large business but without the costly overheads. Our customer base is truly extensive and consists of local authorities to large developers amongst many more which allows us to consistently enjoy continual growth, this is a direct result of customer satisfaction and repeat custom. With safety being at the forefront of everything we do, we ensure that all of our machinery meet all health and safety requirements to carry out the most challenging of projects. We have a personal approach to every customer, the staff that we employ are fully trained and are highly experienced when it comes to providing each of our services so you can expect high levels of professionalism at all times. If you have a general enquiry or you would like a free quote from us then please do not hesitate to get in touch with us via email or by giving us a call on the telephone number provided.",construction
551,"About Us PROCTORS are an independant, family-owned business with over 52 years' standing. Our Printing, Promotional Gifts, Art and Office Supplies divisions, warehousing and distribution facilities make us equally capable of catering for the needs of the smaller local company, competing with the large multi-national companies. Our philosophy is to supply our clients with a high quality products and service at competitive rates. We are proud of the quality of our personnel and the team spirit that exists throughout the company. PROCTORS welcomes the opportunity to supply you with our goods.",print
552,"Since our establishment in 1992, Profab Services have successfully manufactured a premium stainless steel fabrication and precision engineering products for a cross-section of Irish industry. The Pharmaceutical Industry in Ireland is a very sophisticated and dynamic environment. In the last decade Profab Services have been involved in many projects with well-known multinational pharmaceutical companies. This has given us invaluable experience in this industry and has led us to develop a wide client base. We manufacture quality products for the Pharmaceutical, Manufacturing and Architectural/Construction Industries Our dedication in meeting the needs of our clients - through the production of high quality, custom made products, allow us to guarantee a personal service that ensures your deadline is our deadline. Profab Services manufactures the finest quality stainless steel custom products in any size and shape for a diverse group of industries. We design, manufacture, service, repair, reconfigure and install a wide range of custom stainless steel products and equipment. Profab Services is your one-stop solution provider for quality-driven fabrication and precision engineering of custom products, cleanroom furniture, processing tanks, storage tanks, cabinets, work stations conveyors, pipe processing and more. In June 2005, Profab Services relocated to a new modern business park to facilitate our expanding business and to help us achieve the ever increasing needs of our clients. With our State of the Art Technology and In-House Design Expertise, we act as a team in partnership with Engineers and Designers to produce quality products. Providing a full stainless steel fabrication and machining service where high quality components and assemblies are required, has helped us to achieve a wide client base of multinational companies and small businesses.",engineering
