id,about,sector
344,"We are a family run business which began 40 years ago as Irvine Transport. We provided a cross channel delivery service to the UK for big brand names like Marks and Spencer's, Laura Ashley, Ford and Dunnes Stores. Instead of lorries returning to Northern Ireland empty, we began moving furniture back with us. Soon we became a recognised home and office removals company relocating families and individuals to Northern Ireland and Ireland. 40 years on and we have gone from strength to strength! We specialise in home and office removals covering all of Ireland, UK and Europe. We provide twice weekly services to and from the UK, as well as a weekly service to Holland, France, Belgium, Germany and other European destinations.",transportation
345,"Irwin M&E Limited offer complete electrical engineering solutions; adopting quality, integrity and whole life costing as key elements of delivery and sustainability. Regardless of whether we are working on a multi-million pound project or a smaller one-off job, we will deliver the same consistent high standards. Our extensive portfolio of new build and refurbishment electrical engineering projects are spread across the UK and Ireland. With over 20 years' experience, this diverse portfolio ranges from hotels, education, office accommodation, student accommodation, high end residential to nursing facilities and restoration/heritage schemes. IRWIN offer complete Design and Build solutions for both public and private sector clients that deliver award winning service and value, incorporating safety, integrity and sustainability at all times. As we deliver projects from inception to completion, our experienced team is perfectly placed to drive forward improvements through innovative, best value design solutions and aftercare arrangements - all covered with fully protected professional indemnity insurance. Our network of offices in the UK and Ireland ensure a local presence that places a dedicated focus on our clients' needs. IRWIN Mechanical is one of our latest additions to our service offering. Having completed a number of Mechanical Design and Build projects, as well as Mechanical and Electrical Term Service maintenance contracts, we are perfectly positioned to bring clients the most advanced mechanical solutions. Our mechanical engineering solutions are seamlessly integrated to offer complete tailored packages to meet our client's requirements. We ensure confidence in our mechanical solutions through succinct project management coupled with a significant investment in our resources and a commitment to project control. IRWIN Mechanical's project portfolio of new build and refurbishment engineering work is spread right across the UK and Ireland and ranges from hotels and education, healthcare buildings to office accommodation and high end residential.",engineering
346,"ITNI can provide your business with a 1 stop shop for managing ALL of your IT needs. We can supply maintain and support everything from phone lines, phone systems, Broadband/Internet (including router) , Networking equipment (inc. wireless), data cabling, PCs, Servers, laptops, printers, tablets, mobile phones, websites and email. PSNI Security cleared staff for peace of mind. With over 10 years experience working with vendors such as Lenovo, Cisco, Microsoft, VMware, Veeam and Trend Micro, and with over 80 customers in the UK and Ireland, with customers of all sizes; from individuals with home offices, small retail outlets, to supporting some of the largest companies in Northern Ireland, ITNI can provide your business with all of the IT equipment, services and support that it needs.",it
347,"Ivan Scott Associates Ltd. are based in the Coleraine with a high quality, ISO-accredited service since 1994.Using Auto-cad and other computerised design software Ivan Scott Associates Ltd. focus on their clients' needs to deliver a high quality service. We operate a quality management system and are registered with constructionline. The current staff has collectively over 100 years of experience in civil and structural engineering and the key members of staff are chartered members of the relevant institutions namely: The Institution of Civil Engineers The Institution of Structural Engineers Royal Institution of Chartered Surveyors We serve public, commercial and private clients, both locally and further afield. Private, commercial, civil engineering projects and site surveys undertaken.",engineering
348,"JH PRINT Our printing department produce anything from one colour business cards to full colour leaflets and brochures. Full in-house design & photography Business forms NCR books & sets Magazines Leaflets & brochures Folders Continuous computer stationery Digital printing Security printing Banners, posters and display materials Packaging A dedicated member of our sales team can call to your premises, offering advise and suggestions and saving you time. Competitive quotations turned around same or next day. Digital printing service for low volume of high quality colour jobs. Artwork may be sent to us on disc, email or via high speed ISDN line. We accept artwork from Apple Macs or PC's and from most commonly used programs. Total control over quality and delivery times dues to extensive and modern range of printing equipment in-house.",print
349,"BUSINESS CONSULTING HOME ABOUT US SERVICES OUR TEAM CONTACT US FREE CONSULTATION Imagine an accountancy practice that does more than making sure the figures add up. A practice that listens to and cares about its clients. An accountancy practice where the partners and highly trained staff have a genuine desire to offer expert accounting services, advice and share expertise.As a leading firm of accountants and business advisers, J.J. Meegan & Co.'s aim is simple - to draw on our experience and expertise to help you achieve real success. Fresh thinking, diverse skills and a sharp eye for the broader picture mean that together, we can really make things happen. JJ MEEGAN & CO If you have some concerns and wish to take advantage of a confidential personal discussion simply call 028 8224 9373 to arrange a meeting or email us at admin@jjmeegan.com Sometimes the only way to understand a person's business or financial situation is by meeting face-to-face. All new clients or people looking to speak with an accounting professional are offered a free initial consultation. J.J. Meegan & Co exists to offer small and medium-sized businesses, charities and individuals rounded comprehensive, expert accountancy services. We pride ourselves on our down to earth, friendly approach. We will talk to you in plain English and will ""refuse to confuse"" you with technical jargon. We aim to provide a high-quality service at value for money and will confirm the scope and terms of our appointment with you in writing. We operate to the highest ethical standards and provide a completely confidential service. We have decades of experience behind us but our knowledge is 'in the now' and our vision trained on the future. Whatever your requirement - be it starting out with a new business venture, book-keeping, corporate restructure or tax planning for the private client - we have the breadth of expertise to help you achieve your goals.",finance
350,"With over 70 years (3rd Generation) of excellence J McAleer & Sons Ltd. is a market leading distributor and supplier of Plastic Products to the Construction Industry in Ireland and the United Kingdom. A wide range of product sectors including Above and Below Ground Drainage Products, Civil Engineering and Agricultural Applications are available through building and plumbers merchants throughout the UK and Ireland. It is through this background of innovation and ongoing product development that has lead us to our current market position as a leader in pioneering new products and cost effective solutions for the construction and civil engineering sector. J McAleer & Sons Ltd was one of the first to introduce twinwall pipe to Ireland, North and South, almost two decades ago and since then we have continued to develop the range of fittings available with our Atlas Junction System Twinwall Inspection System Moulded Fittings Gully Systems As part of our commitment to serve this sector and the many fast-track programs which we all serve on a daily basis, we carry an extensive stock of Pipe & Fittings from 10mm to 2000mm in diameter. With our own fleet of lorries you are guaranteed prompt delivery to any part of Ireland and the United Kingdom.",construction
351,"J & B Engineering (Lagan Engineering Ltd) is a growing sub contracting engineering business offering 'custom built' products and fully working machines to the sand & gravel, quarry, waste & recycling industry. The family owned company which is based outside Cookstown in Northern Ireland, began in 2004 and is continually growing in experience year after year. With our well equipped workshop and experienced staff, our company delivers a 'professional manufacturing service' to all its customers. We offer you longstanding experience in technical and complex manufacturing solutions. Our customers range from nationally known companies to private individuals and both are of equal importance to us. We have invested in the latest hardware & software to ensure the quality & excellence of all the products we manufacture. Along with our skilled & dedicated workforce we can ensure that all our customer's deadlines are met. Our goal is to satisfy the individual requirements and to ensure that we continue to support them long after the product is purchased.",engineering
352,"We are a group of experienced company with over 20 years in the business with a wide range of services to offer to help you improve and upgrade your humble abode. We work tirelessly to help you build your dream home. We have professional planners, designers and builders at our disposal to provide a custom plan for each individual project.",construction
353,"We have a mission to provide an unrivalled, full service capability in the manufacture, installation, repair, and maintenance of all types of commercial and industrial doors. A total service approach has arisen from our experience in meeting customer requirements at every stage. Based in Northern Ireland JB Door Systems offers guidance, advice and product aftercare in support of a product range that is competitive on many more levels than price alone.",construction
354,"We provide software engineers, UI/UX designers and web developers for your projects. We've assembled specialists with unique expertise in some of the most challenging technical and business domains, so we're able to deliver highly functional, innovative projects to all our clients. We will listen to your ideas and Requirements and fully manage and Deliver your project, keeping you Informed and updated along the way. Consider Us Part of Your Team ! We will Provide You with the Specialist to Get the Job done and You will have Full Control Over the Project with Our team Integrated into Yours ! JD developments offer a wide array of digital marketing services ranging from SEO (Search Engine Optimization), Google AdWords Management, Social Media Management, Custom Logo designs and Content Writing. We don't only want to help build your idea; we want to help ensure it succeeds as well, getting it to the right people, at the right time, in the right way!",it
355,"J.D.C warehousing and distribution is a storage and distribution company, we provide storage for a wide range of goods and materials and then distribute throughout Ireland and the UK. We are relatively a small storage company with a big emphasis on customer service, we are competitive on price and work with any budget that you may have. J.D.C warehousing and distribution offer a wide range of warehousing services to our customers. Our services include dedicated warehouse units available to customers to operate and control themselves. We provide the following services: Order Picking Pick and Pack Short Term/Long Term Storage Stock Management Forklift Services Pallet Retrieval",transportation
356,"Jeff Wilson is a Chartered Architect with over 25 years experience, registered with the Architects Registration Board and holding both RIBA and RSUA membership.Educated at Dundee University and Queens University Belfast he chartered in 1989 and worked for Ferguson McIlveen, Belfast one of Ulster's largest and leading firms of architects with offices throughout the UK. In 1991 he moved back to his roots on the North coast and worked for W & M Given Architects, Coleraine before setting up his own practice in 1993.As a well-experienced architect, working from a home-base, he offers the full spectrum of architectural services and professional advice at very competitive cost. Client's requirements are expertly interpreted, developed and realised with design flair and technical expertise. The resulting computer-aided presentations are clear and precise and can incorporate 3D modelling if required.",construction
357,"For over 50 years JJ Loughran has been one of the UK and Ireland's largest and most diverse Electrical and Mechanical engineering companies; offering a synergy of manufacturing, product supply, installation, maintenance and repair services, both in house and on site. Operating from our head office, warehouse and engineering facilities in Cookstown N.Ireland, Key areas of expertise include Electric Motors, Mechanical Gearboxes & Pumps, Industrial Electrical Installation's & Controls, Electrical Design & Specification and Power Generation.",engineering
358,"The two sides of the JL Goor business are over thirty years supplying the Irish Polymer market with machinery, equipment and polymer materials. By working together closely, our aim as JL Goor is to offer a total solution - equipment and materials - to our customers. The machinery business was the start. As the fledgling Irish polymer processing industry took-off in the early 1980's so did the JL Goor business, with John Goor building a portfolio of equipment to offer. As the business grew John was approached by some customers to find out if he could help them with some polymer sourcing problems. The next stage was to begin building up some polymer expertise and to further strengthen the machinery side. Louis Goor joined his father on the machinery side and Gearoid Clarke, with his Polymer Science background provided the polymer know-how. As polymer sales grew it was decided to form a sister company - JL Goor Materials, to focus exclusively on this area. Over the years both companies have continued to grow and develop. Today both companies work very closely together and use their unique position in the Irish Polymer market to provide creative solutions for our customers.",industry
359,"M Autoparts is known throughout Tyrone and wider Northern Ireland for our first class service and exceptional range of stock. We have parts and spares to suit most types of truck and commercial vehicle. So whether you are looking for air suspension parts or road springs for your truck, we are confident in our ability to help. We endeavour to offer a fast turnaround on all orders regardless of size or your location. We have an experienced team on hand to help with any enquiry that you may have and we will always be happy to help with any enquiry that you may have. Customers come to JM Autoparts because they trust in our service and reliability, as well as our competitive pricing and excellent range of stock. As we stock parts from many major manufacturers we can source many different types of parts to suit a variety of vehicles. We are agents for BPW and ensure that all of our parts are dispatched quickly from our warehouse here in Omagh. Orders are welcome from throughout Northern and the Republic of Ireland and we are happy to offer advice and guidance if you are ever unsure of the right part for your commercial vehicle. We are proud to enjoy an excellent reputation around the region; such is our ability to help our customers find the ideal part for their vehicle, but also our helpful and reliable service. To find out more, or to order a truck suspension system or road springs, simply call or email us today.",transportation
360,"JMM Fire and Security Ltd We are a local Company based in Coleraine but we cover the whole of Northern Ireland. Our field technicians are friendly, experienced, knowledgeable and committed to excellent customer service. Our 2 company directors have over 50 years combined experience in the Fire and Security Industry. We Design, Supply, Install and Service: > Fire Detection and Alarm Systems > Fire Extinguishers Supply and Maintenance > Fire Risk Assessments > Intruder and Hold Up Alarms > CCTV Systems > Access Control > Door Entry Systems > Warden and Nurse Call > Disabled Refuge > Automatic Gates and Barriers > Safes We provide the services listed above for Commercial and Domestic premises -no job is to big or to small. We are accredited to Gold standard by the National Security Inspectorate - the highest standard possible. We are approved by BAFE and we are a Silver Member of Constructionline. If you are considering any of the above services for your home or business, if you are changing your current provider or would like a price comparison - please contact us for a free quotation and/or free consultation including a survey if required. We look forward to hearing from you.",industry
361,"Duke Construction are a building and civil works contractor established in December 1991. Duke Construction carry out works mainly in the Dublin and Leinster area. Our diverse portfolio showcases works we have successfully completed for both public and private clients within a wide range of sectors including including education, healthcare, heritage, residential, sports & leisure, and civil construction.We take immense pride in every project that we undertake, from acceptance to completion our attention to detail is of paramount importance in providing our clients with the best possible service. Our standard and attention to detail is what has provided Duke Construction with repeat clientele throughout the years, we look forward to doing further business with our current clients and look forward to working with new clients in the near future. Tom Donovan | Managing Director",construction
362,"John Flynn Architecture is a Registered member of the RIAI.The practice works closely with clients to understand their individual problems and help find solutions to them, using our experience , professional training and creativity. We also try to make the building process as easy as possible for our clients and their representatives by communicating early and often with them. We offer a range of flexible architectural services in the following areas, One off house design, house extension and refurbishment, commercial and interior design, traditional and contemporary designs, sustainable energy advice, planning and planning retention, disabled bathrooms and dormer attic design, building surveys and snag lists, land registry mapping, conservation , project management. We have a particular expertise in domestic and residential projects , and work with a tried and tested database of builders whom we trust and can recommend, and we can provide referees and contacts for previous clients if required.",construction
363,"John H Place Ltd was founded in the 1940's as a supplier of machinery to the engineering sector.John H Place (Steels) Ltd was established in 1971 as steel stockholders of engineering steels & wrought iron components. Since then the company has grown to be one of the leading steel stockholders in Northern Ireland, providing a fast, friendly service for over 40 years.",engineering
364,"John J Higgins was established in 1945 in Magherafelt, Co. Derry, N. Ireland.Our company has steadily grown over the years to become one of Ireland's leading manufacturers, designers and innovators of Joinery Products.Using of the most up to date materials and technology.Our extensive range is the preferred choice of many architects, housing developers, and contractors.",construction
365,"Johnston Contracts Ltd are a family run business in Northern Ireland providing high quality workmanship for your new kitchen, bedroom or bathroom, and much more. We are general home contractors and can take on any domestic job, large or small throughout Northern Ireland and further afield. Run by a team of two brothers with over 25 years experience in the industry, Johnston Contracts Ltd are the first port of call for home renovations in Northern Ireland. We manufacture new kitchens and bedrooms, provide bathroom refurbishments, tiling, home extensions and more. We use only the finest quality materials available, from the most trusted brands in the business, such as Kitchen Stori, BA components and Blanco to name a few. To get a free quote or discuss a job with us, call on 02892622356. Project management We offer a comprehensive service that means we can project manage the whole renovation from start to finish. We will work with you to finalise plans to your requirements, then oversee all work, whether done by ourselves or sub-contractors, so you can rest easy knowing that the job is taken care of by professionals. If you need a new kitchen, extension or any kind of domestic renovation, new builds, sunrooms and everything in between just call us today on 02892622356. Quality craftsmanship Our team of regular tradesmen are all highly skilled and experienced, so you know that with Johnston Contracts Ltd, you'll get a job well done, whether it's a new kitchen, home extension or bathroom renovation. We also have a list of trusted sub-contractors who we can call in for specialist work, which we also oversee. Personal service As a local, independent, family run business in Lisburn Northern Ireland, Johnston Contracts Ltd offer a more personal and tailored service than larger corporate contractors. We take pride in serving the local community and strive to provide quality, value, and a friendly pleasant service to all of our clients.",construction
366,"We have always believed in service without compromise, and that is an attitude which woven into all aspects of our business. From the striking presentation of the Johnston International fleet, through to our state of the art vehicle tracking and warehousing systems, we are continuously adopting new technologies to improve and evolve, making sure that we remain at the forefront of national and international road haulage services. And it's not just skin deep, because behind our eye catching liveries, we're in tune with our fragile environment too, as we invest in the most fuel efficient trucks on the market to ensure our impact on the ecology is at its absolute minimum.",transportation
367,"Established in 1987, we are a family run business, serving our customers for over 30 years. We carry everything needed for the Trade and DIY sector, specialising in Farm Buildings and Self Build enthusiasts.",construction
368,"JSM was founded in 2021 by Liam Murphy, Liam has over 40 years of experience in the electrical trade industry. JSM, which was formally MPH has innovated itself to become one of the best electrical wholesalers in Dublin. Liam and his trusted side kick John have built up a reputation of providing a great product range, excellent product knowledge and a customer service that is becoming unheard of in the industry. We pride ourselves on offering the best service to our customers.",electrical
369,"Established in 2012, K Magill & Company is a leading independent firm of chartered accountants and business advisors located in Northern Ireland. Whether you are just starting out in business or are already well-established, we have the experience and expertise to provide year-round advice to help move your business forward. We also work with many private individuals, and can suggest strategies to help minimise your personal tax bill, save you money and maximise your wealth. At K Magill & Company we make it our mission to build long-term partnerships with our clients. We take the time to get to know you and your business, allowing us to offer a truly personal service which is tailored to your needs. Furthermore, our friendly team will be on hand to answer all your questions, helping to give you a unique insight into your finances. To discover more about how we can help you, and for a free initial consultation, please do not hesitate to contact us today. We would be delighted to work with you.",finance
